{
  "$schema": "http://json-schema.org/draft-07/schema#",
  "$ref": "#/definitions/PackManifest",
  "definitions": {
    "Handle": {
      "type": "string",
      "allOf": [
        {
          "pattern": "^@[a-z0-9_](?:[a-z0-9_-]*[a-z0-9_])?$",
          "title": "Handle",
          "description": "A unique username or organization name starting with @, like @my-org.",
          "examples": ["@my-org", "@username"]
        }
      ]
    },
    "Version": {
      "type": "string",
      "allOf": [
        {
          "pattern": "^(0|[1-9]\\d*)\\.(0|[1-9]\\d*)\\.(0|[1-9]\\d*)(?:-((?:0|[1-9]\\d*|\\d*[a-zA-Z-][0-9a-zA-Z-]*)(?:\\.(?:0|[1-9]\\d*|\\d*[a-zA-Z-][0-9a-zA-Z-]*))*))?(?:\\+([0-9a-zA-Z-]+(?:\\.[0-9a-zA-Z-]+)*))?$",
          "title": "Version",
          "description": "A semver version like 1.0.0. Ranges are not allowed here.",
          "examples": ["1.0.0", "2.3.1", "0.1.0-beta.1"]
        }
      ]
    },
    "Author": {
      "type": "object",
      "properties": {
        "name": { "type": "string" },
        "email": { "anyOf": [{ "type": "string" }, { "type": "null" }] },
        "url": { "anyOf": [{ "type": "string" }, { "type": "null" }] }
      },
      "required": ["name"],
      "additionalProperties": false,
      "title": "Author",
      "description": "Author details: name, email, and URL."
    },
    "PackageUrl": {
      "type": "string",
      "allOf": [
        {
          "pattern": "^[Pp][Kk][Gg]:[a-zA-Z][a-zA-Z0-9.+-]*\\/.+$",
          "title": "Package URL",
          "description": "A Package URL (purl) string identifying a package across ecosystems (e.g. pkg:npm/react@18.2.0).",
          "examples": ["pkg:npm/react@18.2.0", "pkg:pypi/requests@2.31.0", "pkg:cargo/serde@1.0"]
        }
      ]
    },
    "ExtensionName": {
      "type": "string",
      "allOf": [
        {
          "pattern": "^[a-z0-9](?:[a-z0-9-]{0,62}[a-z0-9])?$",
          "title": "Extension Name",
          "description": "The name of an extension — lowercase letters, numbers, and hyphens (e.g. my-skill).",
          "examples": ["my-skill", "code-review", "prettier"]
        }
      ]
    },
    "NonPackExtensionFqn": {
      "type": "string",
      "allOf": [
        {
          "pattern": "^(@[a-z0-9_](?:[a-z0-9_-]*[a-z0-9_])?)\\/(skills|commands|mcp-servers|subagents|files|rules)\\/([a-z0-9](?:[a-z0-9-]{0,62}[a-z0-9])?)$",
          "title": "Non-Pack Extension FQN",
          "description": "Fully qualified extension name in @handle/type/name form, restricted to non-pack types like skills, commands, mcp-servers, subagents, files, and rules.",
          "examples": ["@acme/skills/code-review", "@my-org/commands/format"]
        }
      ]
    },
    "VersionRange": { "type": "string" },
    "PackManifest": {
      "type": "object",
      "properties": {
        "$schema": { "anyOf": [{ "type": "string" }, { "type": "null" }] },
        "owner": { "$ref": "#/definitions/Handle" },
        "version": { "$ref": "#/definitions/Version" },
        "description": { "anyOf": [{ "type": "string" }, { "type": "null" }] },
        "keywords": {
          "anyOf": [{ "type": "array", "items": { "type": "string" } }, { "type": "null" }]
        },
        "repository": { "anyOf": [{ "type": "string" }, { "type": "null" }] },
        "homepage": { "anyOf": [{ "type": "string" }, { "type": "null" }] },
        "license": { "anyOf": [{ "type": "string" }, { "type": "null" }] },
        "bugs": { "anyOf": [{ "type": "string" }, { "type": "null" }] },
        "authors": {
          "anyOf": [
            { "type": "array", "items": { "$ref": "#/definitions/Author" } },
            { "type": "null" }
          ]
        },
        "compatiblePackages": {
          "anyOf": [
            {
              "type": "array",
              "description": "Packages this extension is designed to work with, as Package URLs (purls).",
              "items": { "$ref": "#/definitions/PackageUrl" }
            },
            { "type": "null" }
          ]
        },
        "type": { "type": "string", "enum": ["pack"] },
        "name": { "$ref": "#/definitions/ExtensionName" },
        "dependencies": {
          "type": "object",
          "patternProperties": {
            "^(@[a-z0-9_](?:[a-z0-9_-]*[a-z0-9_])?)\\/(skills|commands|mcp-servers|subagents|files|rules)\\/([a-z0-9](?:[a-z0-9-]{0,62}[a-z0-9])?)$": {
              "$ref": "#/definitions/VersionRange"
            }
          }
        }
      },
      "required": ["owner", "version", "type", "name", "dependencies"],
      "additionalProperties": false,
      "title": "Pack Manifest",
      "description": "Configuration file (pack.json) that bundles multiple extensions into a single installable pack."
    }
  }
}
