{
  "$schema": "https://axm.sh/schemas/pack.schema.json",
  "owner": "@craigsmitham",
  "version": "0.2.1",
  "description": "Capture operational occurrences and turn recurring patterns into evidence-prioritized findings and verified improvements",
  "keywords": [
    "field-notes",
    "observation",
    "continuous-improvement",
    "friction",
    "developer-experience",
    "retrospective",
    "kaizen"
  ],
  "repository": {
    "type": "git",
    "url": "https://github.com/craigsmitham/agent-extensions",
    "directory": "packs/field-notes"
  },
  "homepage": "https://github.com/craigsmitham/agent-extensions",
  "license": "CC-BY-SA-4.0",
  "type": "pack",
  "name": "field-notes",
  "dependencies": {
    "@craigsmitham/knowledge/field-notes": "^0.2.0",
    "@craigsmitham/rules/field-notes": "^0.2.0",
    "@craigsmitham/skills/field-notes": "^0.2.0"
  }
}
