{
  "$schema": "https://axm.sh/schemas/pack.schema.json",
  "owner": "@agentxm",
  "version": "0.12.0",
  "description": "Agent engineering knowledge with workflows for authoring and auditing agent instructions and Agent Skills",
  "keywords": [
    "agent-engineering",
    "ai-agents",
    "agentic-systems",
    "prompt-engineering",
    "context-engineering",
    "harness-engineering",
    "skill-engineering",
    "agent-instructions",
    "agent-skills"
  ],
  "homepage": "https://agentxm.ai",
  "license": "MIT",
  "type": "pack",
  "name": "agent-engineering",
  "dependencies": {
    "@agentxm/knowledge/agent-engineering": ">=0.11.0",
    "@agentxm/skills/agent-instructions": ">=0.2.0",
    "@agentxm/skills/agent-skills": ">=0.2.0"
  }
}
