{
  "$schema": "https://axm.sh/schemas/pack.schema.json",
  "owner": "@craigsmitham",
  "version": "1.0.0",
  "description": "Capture concise factual notes about friction encountered during agent sessions for later analysis",
  "keywords": [
    "field-notes",
    "observation",
    "continuous-improvement",
    "friction",
    "developer-experience",
    "session-friction",
    "evidence"
  ],
  "repository": {
    "type": "git",
    "url": "https://github.com/craigsmitham/agent-extensions",
    "directory": "packs/field-notes"
  },
  "homepage": "https://github.com/craigsmitham/agent-extensions",
  "license": "CC-BY-SA-4.0",
  "type": "pack",
  "name": "field-notes",
  "dependencies": {
    "@craigsmitham/knowledge/field-notes": "^1.0.0",
    "@craigsmitham/rules/field-notes": "^1.0.0",
    "@craigsmitham/skills/field-notes": "^1.0.0"
  }
}
