{
  "$schema": "https://axm.sh/schemas/pack.schema.json",
  "owner": "@craigsmitham",
  "version": "0.6.0",
  "description": "Human-first software architecture knowledge and profile-conforming workflows for required system context and concise semantic deltas over repository evidence",
  "keywords": [
    "software-architecture",
    "architecture-documentation",
    "architecture-docs",
    "c4-model",
    "domain-driven-design",
    "wardley-mapping",
    "offerings",
    "jobs-to-be-done",
    "value-propositions",
    "use-cases",
    "quality-attributes",
    "product-quality-requirements",
    "boundaries",
    "invariants",
    "progressive-disclosure",
    "human-comprehension",
    "semantic-delta",
    "stable-identity",
    "setup",
    "maintenance",
    "lifecycle",
    "ownership",
    "architecture-decisions",
    "assurance",
    "architecture-constraints"
  ],
  "repository": {
    "type": "git",
    "url": "https://github.com/craigsmitham/agent-extensions",
    "directory": ".axm/extensions/@craigsmitham/packs/software-architecture"
  },
  "homepage": "https://github.com/craigsmitham/agent-extensions",
  "license": "MIT",
  "type": "pack",
  "name": "software-architecture",
  "dependencies": {
    "@craigsmitham/knowledge/software-architecture": ">=3.1.0",
    "@craigsmitham/skills/author-architecture-docs": ">=3.1.0",
    "@craigsmitham/skills/setup-architecture-docs": ">=0.5.0",
    "@craigsmitham/skills/reconcile-architecture-docs": ">=0.3.0"
  }
}
